{
  "$schema": "https://json-schema.org/draft/2020-12/schema",
  "$id": "https://nativedoctor.dev/schema/sequence.json",
  "title": "Sequence",
  "description": "An ordered flow of resource calls. References call-type resources by path or id; supports sequential/parallel/async and optional env persistence. Files use YAML format (.sequence.yaml).",
  "type": "object",
  "properties": {
    "name": {
      "type": "string",
      "description": "Display name for the sequence."
    },
    "description": {
      "type": "string",
      "description": "Short description of the sequence."
    },
    "steps": {
      "type": "array",
      "description": "Ordered list of steps. Each step runs a call-type resource.",
      "items": {
        "type": "object",
        "properties": {
          "resource": {
            "type": "string",
            "description": "Path to a .request.yaml (or other call-type resource) relative to the collection, or a logical id. E.g. 'auth/login.request.yaml' or 'login'."
          },
          "mode": {
            "type": "string",
            "enum": ["sequential", "parallel", "async"],
            "default": "sequential",
            "description": "How this step runs relative to others. sequential = after previous; parallel = with siblings; async = fire-and-forget."
          },
          "setEnv": {
            "type": "object",
            "additionalProperties": { "type": "string" },
            "description": "Maps environment variable names to values (response paths or expressions). E.g. { \"auth_token\": \"{{response.body.token}}\" }."
          },
          "condition": {
            "type": "string",
            "description": "Rhai expression; if falsy, step may be skipped. Optional for v1."
          },
          "timeout": {
            "type": "number",
            "description": "Per-step timeout in milliseconds. Optional for v1."
          }
        },
        "required": ["resource"]
      }
    },
    "onFailure": {
      "type": "string",
      "enum": ["abort", "continue"],
      "description": "Behavior when a step fails: abort the sequence or continue with the rest."
    }
  },
  "required": ["steps"]
}
